{
  "behavior": "test",
  "bindingsHash": "none",
  "configHash": "db8ace477c1894be4cdbb4a57500b0a6f68cfd701a38487d0c8e6c71fab7a497",
  "endedAt": "2026-09-02T23:02:09.079Z",
  "exitCode": 1,
  "flows": {
    "flows/booking-compensation.flow": {
      "failed": 2,
      "passed": 0,
      "skipped": 6,
      "status": "failed"
    },
    "flows/execution.flow": {
      "failed": 1,
      "passed": 0,
      "skipped": 0,
      "status": "failed"
    },
    "flows/natural_language_login.flow": {
      "failed": 1,
      "passed": 0,
      "skipped": 0,
      "status": "failed"
    },
    "flows/simple.flow": {
      "failed": 1,
      "passed": 0,
      "skipped": 0,
      "status": "failed"
    },
    "flows/svatah.flow": {
      "failed": 1,
      "passed": 0,
      "skipped": 15,
      "status": "failed"
    }
  },
  "invoker": {
    "id": "local",
    "kind": "user",
    "via": "cli"
  },
  "planHash": "c689d0cc3eb82dd726884b22888f68d4c24b23f2528d2798e8396256459e1ab9",
  "runId": "none-2",
  "schemaVersion": "1.0.0",
  "startedAt": "2026-09-02T23:02:08.388Z",
  "totals": {
    "aborted": 0,
    "failed": 6,
    "healed": 0,
    "passed": 0,
    "skipped": 21
  }
}

